{
  "$schema": "https://www.schemastore.org/onyx-v1.json",
  "format": "onyx",
  "specVersion": "1.0.0",
  "exportedAt": "2026-08-14T12:30:15+03:00",
  "timeZone": "Asia/Jerusalem",
  "producer": { "name": "Burnin", "version": "1.2.0", "platform": "android" },
  "subject": {
    "sex": "female",
    "age": { "value": 34, "unit": "a" },
    "height": { "value": 165, "unit": "cm" },
    "preferredUnits": { "mass": "kg", "energy": "kcal" }
  },
  "goals": [
    { "type": "targetWeight", "value": { "value": 62, "unit": "kg" } },
    { "type": "weightDirection", "direction": "loss" }
  ],
  "days": [
    {
      "date": "2026-08-12",
      "energyConsumed": { "value": 1804, "unit": "kcal" },
      "entries": [
        {
          "loggedAt": "2026-08-12T08:30:00+03:00",
          "mealType": "breakfast",
          "name": "Oats",
          "identifiers": { "fdcId": 169705 },
          "quantity": { "value": 1, "unit": "1" },
          "servingDescription": "1 cup",
          "nutrients": {
            "energy": { "value": 389, "unit": "kcal" },
            "protein": { "value": 16.9, "unit": "g" },
            "carbohydrate": { "value": 66, "unit": "g" },
            "fat": { "value": 6.9, "unit": "g" }
          },
          "source": "database"
        },
        {
          "loggedAt": "2026-08-12T13:05:00+03:00",
          "mealType": "lunch",
          "name": "Chicken bowl",
          "quantity": { "value": 1.5, "unit": "1" },
          "servingDescription": "bowl",
          "nutrients": { "energy": { "value": 715, "unit": "kcal" } },
          "source": "estimated",
          "confidence": 0.62,
          "note": "eyeballed the rice"
        }
      ]
    },
    {
      "date": "2026-08-13",
      "energyConsumed": { "value": 0, "unit": "kcal" },
      "note": "fasted"
    }
  ],
  "bodyMeasurements": [
    {
      "observedAt": "2026-08-12T07:00:00+03:00",
      "type": "bodyMass",
      "value": { "value": 80.4, "unit": "kg" }
    },
    {
      "observedAt": "2026-08-13T07:04:00+03:00",
      "type": "bodyMass",
      "value": { "value": 80.1, "unit": "kg" }
    }
  ],
  "extensions": {
    "ltd.bein.burnin": {
      "blockVersion": 1,
      "entries": {
        "USER": "{\"gender\":false,\"age\":34,\"height\":165,\"targetWeight\":62,\"goalType\":\"loss\",\"unitSystem\":\"metric\"}",
        "DAY-Wed Aug 12 2026": "{\"date\":\"2026-08-12T00:00:00.000Z\",\"caloriesConsumed\":1804,\"weight\":80.4,\"smoothedWeight\":80.45,\"runningTDEE\":2180,\"meals\":[]}",
        "BURNIN_TDEE_HISTORY": "[{\"date\":\"2026-08-12\",\"tdee\":2180}]"
      }
    }
  }
}
