{
  "format": "onyx",
  "specVersion": "1.0.0",
  "exportedAt": "2026-08-11T20:00:00+02:00",
  "timeZone": "Europe/Berlin",
  "producer": { "name": "Some Other Tracker" },
  "days": [
    {
      "date": "2026-08-10",
      "entries": [
        {
          "loggedAt": "2026-08-10T08:30:00+02:00",
          "mealType": "breakfast",
          "name": "Oats",
          "nutrients": { "energy": { "value": 389, "unit": "kcal" } }
        }
      ]
    }
  ],
  "bodyMeasurements": [
    { "observedAt": "2026-08-10T07:00:00+02:00", "type": "bodyMass", "value": { "value": 177.5, "unit": "[lb_av]" } }
  ]
}
