{
  "format": "onyx",
  "specVersion": "1.0.0",
  "exportedAt": "2026-08-14T09:00:00+02:00",
  "timeZone": "Europe/Berlin",
  "producer": {
    "name": "Weighs Twice"
  },
  "days": [
    {
      "date": "2026-08-10",
      "entries": [
        {
          "loggedAt": "2026-08-10T08:30:00+02:00",
          "name": "Oats",
          "nutrients": {
            "energy": {
              "value": 389,
              "unit": "kcal"
            }
          }
        }
      ]
    }
  ],
  "bodyMeasurements": [
    {
      "observedAt": "2026-08-10T21:00:00+02:00",
      "type": "bodyMass",
      "value": {
        "value": 80,
        "unit": "kg"
      }
    },
    {
      "observedAt": "2026-08-10T07:00:00+02:00",
      "type": "bodyMass",
      "value": {
        "value": 82,
        "unit": "kg"
      }
    }
  ]
}
