{
  "format": "onyx",
  "specVersion": "1.0.0",
  "exportedAt": "2026-08-10T09:00:00+09:00",
  "timeZone": "Europe/Berlin",
  "producer": {
    "name": "Travelling Tracker"
  },
  "days": [
    {
      "date": "2026-08-09",
      "entries": [
        {
          "loggedAt": "2026-08-09T19:00:00+09:00",
          "mealType": "dinner",
          "name": "Ramen",
          "nutrients": {
            "energy": {
              "value": 620,
              "unit": "kcal"
            }
          }
        }
      ]
    }
  ],
  "bodyMeasurements": [
    {
      "observedAt": "2026-08-10T00:30:00+09:00",
      "type": "bodyMass",
      "value": {
        "value": 70.5,
        "unit": "kg"
      }
    }
  ]
}
