{
  "format": "onyx",
  "specVersion": "1.0.0",
  "exportedAt": "2026-08-14T09:00:00+02:00",
  "timeZone": "Europe/Berlin",
  "producer": {
    "name": "",
    "version": "3.1.0"
  },
  "days": [
    {
      "date": "",
      "entries": [
        {
          "loggedAt": "",
          "name": "Oats"
        }
      ]
    }
  ],
  "bodyMeasurements": [
    {
      "observedAt": "",
      "type": "",
      "value": {
        "value": 70,
        "unit": "kg"
      }
    }
  ]
}
