{
  "format": "onyx",
  "specVersion": "1.0.0",
  "exportedAt": "2026-08-10T09:12:00+03:00",
  "producer": { "name": "Richer Vocabulary" },
  "days": [
    {
      "date": "2026-08-10",
      "entries": [
        {
          "loggedAt": "2026-08-10T11:00:00+03:00",
          "mealType": "brunch",
          "name": "Shakshuka",
          "nutrients": { "energy": { "value": 420, "unit": "kcal" } }
        }
      ]
    }
  ]
}
